{
  "story_id": "STORY-184",
  "workflow_started": "2026-01-07T13:12:20.367732Z",
  "current_phase": "10",
  "phases": {
    "01": {
      "status": "completed",
      "subagents_required": [
        "git-validator",
        "tech-stack-detector"
      ],
      "subagents_invoked": [
        "git-validator",
        "tech-stack-detector"
      ],
      "started_at": "2026-01-07T13:14:57.489609Z",
      "completed_at": "2026-01-07T13:15:04.432736Z",
      "checkpoint_passed": true
    },
    "02": {
      "status": "completed",
      "subagents_required": [
        "test-automator"
      ],
      "subagents_invoked": [
        "test-automator"
      ],
      "started_at": "2026-01-07T13:22:25.679289Z",
      "completed_at": "2026-01-07T13:22:25.830254Z",
      "checkpoint_passed": true
    },
    "03": {
      "status": "completed",
      "subagents_required": [],
      "subagents_invoked": [
        "backend-architect",
        "context-validator"
      ],
      "started_at": "2026-01-07T13:51:33.148332Z",
      "completed_at": "2026-01-07T13:51:33.421474Z",
      "checkpoint_passed": true
    },
    "04": {
      "status": "completed",
      "subagents_required": [
        "refactoring-specialist",
        "code-reviewer"
      ],
      "subagents_invoked": [
        "refactoring-specialist",
        "code-reviewer"
      ],
      "started_at": "2026-01-07T14:05:14.062027Z",
      "completed_at": "2026-01-07T14:05:14.349042Z",
      "checkpoint_passed": true
    },
    "05": {
      "status": "completed",
      "subagents_required": [
        "integration-tester"
      ],
      "subagents_invoked": [
        "integration-tester"
      ],
      "started_at": "2026-01-07T14:07:22.006973Z",
      "completed_at": "2026-01-07T14:07:22.141778Z",
      "checkpoint_passed": true
    },
    "06": {
      "status": "completed",
      "subagents_required": [],
      "subagents_invoked": [],
      "completed_at": "2026-01-07T14:08:00.802793Z",
      "checkpoint_passed": true
    },
    "07": {
      "status": "completed",
      "subagents_required": [],
      "subagents_invoked": [],
      "completed_at": "2026-01-07T14:08:56.582767Z",
      "checkpoint_passed": true
    },
    "08": {
      "status": "completed",
      "subagents_required": [],
      "subagents_invoked": [],
      "completed_at": "2026-01-07T14:10:31.371664Z",
      "checkpoint_passed": true
    },
    "09": {
      "status": "completed",
      "subagents_required": [],
      "subagents_invoked": [],
      "completed_at": "2026-01-07T14:10:57.897663Z",
      "checkpoint_passed": true
    },
    "10": {
      "status": "completed",
      "subagents_required": [
        "dev-result-interpreter"
      ],
      "subagents_invoked": [
        "dev-result-interpreter"
      ],
      "started_at": "2026-01-07T14:12:27.008860Z",
      "completed_at": "2026-01-07T14:12:27.145138Z",
      "checkpoint_passed": true
    }
  },
  "validation_errors": [],
  "blocking_status": false
}