{
  "story_id": "STORY-161",
  "workflow_started": "2026-01-01T14:40:06.742775Z",
  "current_phase": "08",
  "phases": {
    "01": {
      "status": "completed",
      "subagents_required": [
        "git-validator",
        "tech-stack-detector"
      ],
      "subagents_invoked": [
        "git-validator",
        "tech-stack-detector"
      ],
      "started_at": "2026-01-01T14:49:49.732305Z",
      "completed_at": "2026-01-01T14:49:56.845359Z",
      "checkpoint_passed": true
    },
    "02": {
      "status": "completed",
      "subagents_required": [
        "test-automator"
      ],
      "subagents_invoked": [
        "test-automator"
      ],
      "started_at": "2026-01-01T15:06:02.426696Z",
      "completed_at": "2026-01-01T15:06:12.617283Z",
      "checkpoint_passed": true
    },
    "03": {
      "status": "completed",
      "subagents_required": [],
      "subagents_invoked": [
        "context-validator"
      ],
      "started_at": "2026-01-01T15:10:30.501419Z",
      "completed_at": "2026-01-01T15:10:37.242429Z",
      "checkpoint_passed": true
    },
    "04": {
      "status": "completed",
      "subagents_required": [
        "refactoring-specialist",
        "code-reviewer"
      ],
      "subagents_invoked": [
        "refactoring-specialist",
        "code-reviewer"
      ],
      "started_at": "2026-01-01T15:12:19.149599Z",
      "completed_at": "2026-01-01T15:12:25.847962Z",
      "checkpoint_passed": true
    },
    "05": {
      "status": "completed",
      "subagents_required": [
        "integration-tester"
      ],
      "subagents_invoked": [
        "integration-tester"
      ],
      "started_at": "2026-01-01T16:19:19.765451Z",
      "completed_at": "2026-01-01T16:19:25.599400Z",
      "checkpoint_passed": true
    },
    "06": {
      "status": "completed",
      "subagents_required": [],
      "subagents_invoked": [],
      "completed_at": "2026-01-01T16:21:44.039825Z",
      "checkpoint_passed": true
    },
    "07": {
      "status": "completed",
      "subagents_required": [],
      "subagents_invoked": [],
      "completed_at": "2026-01-01T16:23:17.847596Z",
      "checkpoint_passed": true
    },
    "08": {
      "status": "pending",
      "subagents_required": [],
      "subagents_invoked": []
    },
    "09": {
      "status": "pending",
      "subagents_required": [],
      "subagents_invoked": []
    },
    "10": {
      "status": "pending",
      "subagents_required": [
        "dev-result-interpreter"
      ],
      "subagents_invoked": []
    }
  },
  "validation_errors": [],
  "blocking_status": false
}